original_index,split_source,standard,A,B,C,winner
33,train,"hôm nay thấy hiếm cụ nhỉ , hồi đấy toàn vô Cầu Trỗi hái.","It's rare to see them today, isn't it? Back then, we used to go to Cau Troi to pick them.","It seems rare to see today, doesn't it? Back then, I used to go to Cau Troi to pick them all the time.","Today I notice [they're] quite rare, back then [we] would always go to Cầu Trỗi to pick [them].",A
7234,train,Mày ngứa miệng à?,Are you itching to talk?,Are you itching to say something?,Your mouth itching or something?,B
8681,train,Mẹ nào khéo đẻ vậy nhỉ?,What a skillful mother she is!,Which mother is so skilled at giving birth?,Which mother gave birth so skillfully?,
5982,train,Vậy cho rồi. Bữa nào sắm một tấm lưới chở đi.,Okay then. I'll buy a fishing net and take it somewhere sometime.,"Fine, let's go with that. Some day I'll buy a net to carry it.",Alright then. Sometime I'll get a net to take over there.,C
7065,train,Mày đi đâu vậy? Thế không về ăn cơm à?,Where are you going? Aren't you coming home for dinner?,Where are you going? So you're not coming back to eat?,Where are you going? So you're not coming home for dinner?,C
5884,train,Và anh ấy ném điện thoại lên nóc nhà.,And he threw the phone onto the roof.,And he threw the phone onto the roof of the house.,And he threw the phone onto the roof.,A
694,train,"thần tượng tuổi thơ đấy, chứ đùa à.","He's a childhood idol, no joke.","That's my childhood idol, no joke.","That's my childhood idol, seriously.",B
8944,train,"Chồng con không lo kiếm đi, đi khắp nơi làm khổ bà con vậy bão ơi là bão.","Instead of focusing on earning a living, he goes around causing trouble for his neighbors, oh what a terrible storm!","My husband doesn't worry about earning a living, but instead goes everywhere causing misery for people; oh storm, oh storm.","Husband and kids don't bother making money, going around everywhere to cause trouble for people, oh what a terrible storm!",
6720,train,"Toàn các em cao vút, thích nhỉ.","They're all so tall, how nice.","Everyone is so tall, how nice.","They're all so tall, I love it.",A
8312,train,"Có biết uống đâu, chắc hôm nào phải tập uống với người ta thôi.","I don't know how to drink, I guess I'll have to practice with someone sometime.","I don't even know how to drink, so I'll probably have to practice drinking with others some day.","I don't even know how to drink, so I'll probably just have to practice drinking with someone someday.",C
1160,train,"Em giờ nằm lê lết ở giường, đi đâu tranh nổi?","I'm lying here in bed right now, how could I possibly go anywhere to compete for anything?","I'm just lying around in bed right now, how could I possibly compete to go anywhere?","I can barely get out of bed now, let alone go anywhere.",A
3284,train,giờ có một đĩa trứng vịt lộn nhậu nữa là tuyệt vời,"Now, having a plate of fertilized duck eggs to go with the meal would be perfect.","Now, if there were a plate of fetal duck eggs to snack on, it would be wonderful.","Right now, if I had a plate of balut to eat while drinking, that would be amazing.",C
1768,train,em tiếp không để anh biết anh vê đây này,I continued without letting him know I was back here.,"Are you continuing, or should I know so I can go home now?",I won't continue so you know I'm coming back here,A
7300,train,Anh cụng 7 năm kinh nghiệm chứ gì nữa.,"He has 7 years of experience, right?","I have 7 years of experience, after all.","I have 7 years of experience, obviously.",C
4137,train,Hèn gì nằm mà thấy tê tê cả người!,No wonder I felt a tingling sensation all over my body while lying down!,No wonder I felt a tingling sensation all over my body while lying down!,No wonder my whole body feels all tingly when I lie down!,C
9148,train,Mày nói sân si con nhà họ vậy.,You're just being envious of their children.,Why are you being so judgmental about that family's child?,You say they're jealous of other people's kids like that.,C
10472,train,Trại nào cũng chết hết như vầy kia. Tội người kinh doanh.,Every camp is dying like this. It's a shame for the business owners.,Every farm is dying like that. I feel sorry for the business owners.,All camps are shutting down like this. Poor business owners.,C
9080,train,"Bạn thấy ai cứ xưng vợ vậy, rồi đã có ai chưa chứ cũng nhiều đó.","You see many people who keep calling themselves ""wife,"" but are they actually married? There are quite a few of them.",Who do you see calling themselves a wife like that? And have they actually had anyone yet? There are quite a few of them.,"Do you see someone who keeps calling themselves ""wife"" like that, then has anyone actually [become one] yet or not, there are quite many though.",A
7109,train,Trang nào cũng thấy anh vậy?,I see him on every page!,Why do I see you on every page?,Do you appear on every page like this?,B
4165,train,"Quảng Bình hôm nay xanh lắm, mát đẹp.",Quang Binh is so green and beautiful today.,"Quang Binh is very green today, cool and beautiful.","Quảng Bình is very green today, cool and beautiful.",C
621,train,Chỗ nào đây bạn nhỉ?,Where is this place?,"Where is this, my friend?",Where is this place?,A
2676,train,"Chắc mới ngủ dậy, chắc hè làm một chuyến ta đi câu biển.",He must have just woken up. Maybe we should take a fishing trip to the sea this summer.,"Probably just woke up, maybe we should take a trip to go sea fishing this summer.","Probably just woke up, I think I'll go on a sea fishing trip this summer.",B
9280,train,2 con báo đánh rồi chọc nhau cả ngày chứ không phải thiên thần.,"Those two leopards fought and teased each other all day, they weren't angels.","Two troublemakers who fight and tease each other all day, not angels.","The two little brats fought and poked at each other all day, not angels.",A
5214,train,10 năm quên nào được chị,How could I forget you after 10 years?,"Which 10 years, sister?","10 years, how could I possibly forget you?",C
1022,train,đợi đoạn chót nhé mọi người ngon lắm,"Wait until the end, everyone, it's delicious!","Wait for the last part, everyone, it's really good.","Wait for the ending, everyone, it's really good!",B
8733,train,Luyện mồm đi cái mạnh kìa.,"Practice your speaking skills, you're getting stronger!",Practice speaking more confidently.,"Practice more strongly, won't you!",A
1731,train,"Sợ ông bạn đây quá. Cố 2,3 năm nữa thôi nhé","I'm really scared of you, my friend. Just hold on for another two or three years, okay?","I'm so scared of this friend of mine. Just try for another 2 or 3 years, okay?","This guy here is incredible. Just push through 2-3 more years, okay?",A
8387,train,Cô này dâu nhà ai vậy ông?,"Whose daughter-in-law is she, sir?","Whose daughter-in-law is this woman, man?","Which family did this young woman marry into, sir?",A
9699,train,Tối mà không vào màn thì chỉ có sưng cả người.,"If you don't go under the mosquito net at night, your whole body will swell up.","If I don't sleep under a mosquito net at night, my whole body will just end up swollen.","If you don't go to bed at night, you'll just end up all swollen from mosquito bites.",B
3059,train,Dưới này không mưa. Nóng mồ hôi hột đây.,It's not raining down here. It's so hot I'm sweating profusely.,It's not raining down here. I'm sweating buckets.,It's not raining down here. I'm sweating bullets.,A
1277,train,Nghe nhạc là thấy vui vậy đấy,Listening to music makes me happy.,Listening to music just makes me feel happy like that.,"Listening to music, I just feel happy like that.",
5606,train,Nhớ ngồi ở đâu nữa không,Do you remember where else you sat?,Do you remember where else we sat?,Do you remember where we sat again?,B
6914,train,"gì cực vậy, Go thì không có bóng người","That's terrible, there's not a soul in sight on Go.",Why is it so extreme? There isn't a soul in Go.,"how extreme is that, Go is completely empty with no one around",A
1010,train,Bây giờ có lẽ không ai nói ghép nữa.,"Now, perhaps no one would say ""grafting"" anymore.",Perhaps no one talks about pairing anymore now.,Now probably no one talks about pairing up anymore.,C
1501,train,Thầy nào mà làm ăn uy tín thế này.,What a reputable teacher!,What a reputable teacher.,Which guy runs such trustworthy business like this.,A
303,train,mình cũng Quảng Trị sao không nghe được chị nói cái gì luôn,"I'm also from Quang Tri, but I couldn't hear anything you said.","I'm also from Quang Tri, but I can't understand anything you're saying.","I'm also from Quảng Trị, why can't I hear what you're saying at all",C
2927,train,Năm nay có như năm ngoái không nhỉ?,Will this year be like last year?,I wonder if this year will be like last year?,I wonder if this year will be like last year.,B
710,train,"Tặng hòn đá tắm để kỳ lưng cho nhau, sướng lắm mà không ngứa nữa.",Giving each other bath stones to scrub our backs is so nice and relieves the itching.,Give each other bathing stones to scrub each other's backs; it feels great and doesn't itch anymore.,Gifting each other bath stones to scrub each other's backs feels amazing and the itching is finally gone.,A
856,train,Sau này bay về Bình Phước cho lẹ.,I'll fly back to Binh Phuoc later to save time.,"In the future, I'll fly back to Binh Phuoc to make it faster.",Let's fly back to Bình Phước quickly later on.,A
9258,train,"Đắt gấp 3 lần , sợ.","It's three times more expensive, I'm scared.","Three times as expensive, I'm scared.","It's three times more expensive, I'm scared.",A
2751,train,Tay lái ẩu nhỉ?,"That's a reckless driver, isn't it?","Reckless driving, isn't it?",What a reckless driver!,A
1691,train,Vợ dùng hột không có quen nhá cô.,"My wife isn't used to using seeds, you know.","My wife isn't used to using seeds, ma'am.","My wife uses it but isn't familiar with it, dear.",B
5360,train,nào có dịp đi check-in phát nhỉ?,When will we have the chance to go check it out?,"When there's an opportunity, let's go check in, shall we?","Let's go check in whenever we get the chance, yeah?",A
8961,train,Đẹp thật nhưng mà tôi lười ra đường chơi khủng khiếp!,"It's beautiful, but I'm incredibly lazy about going out!","It's truly beautiful, but I'm terribly lazy to go out!","It's really beautiful, but I'm way too lazy to go out and have fun!",C
5431,train,"sang ghê vậy, nói chứ không thấy ở đâu kìa",That's amazing! I can't even find it anywhere.,"So fancy, you talk about it but I don't see it anywhere.",You're here but I can't see you anywhere!,A
8631,train,Chỉ là mua mỹ phẩm thôi mà sao bị nhiều thế?,"It's just cosmetics, why is it so expensive?","I was just buying cosmetics, so why did I get so many?","I just wanted to buy some cosmetics, why are there so many?",B
5928,train,"còn trắng trẻo vậy thì chưa có gì, khi nào da ngâm ngâm vậy đã, lúc đó mới thấm","If your skin is still fair, there's nothing to worry about yet. It'll only really work when your skin gets a little tanned.","If you're still that fair-skinned, it's nothing; once your skin is a bit tanned, that's when you'll truly feel it.","it's still this fair, so there's nothing special yet. Once the skin is already this tanned, then it will really get absorbed",B
1578,train,Sao biết ngon. Tưởng vậy là dễ thương đỏ?,How do you know it's delicious? Did you think it was cute and red?,"How do you know it's delicious? You thought that was cute, huh?",How do you know it's delicious? I thought it would be cute and embarrassing?,A
1862,train,Làm sao mà không cho lấy gái Hà Tĩnh lại khuyên lấy gái Nghệ,How can you forbid marrying a girl from Ha Tinh but advise marrying a girl from Nghe An?,"How is it that they tell you not to marry a girl from Ha Tinh, yet advise you to marry a girl from Nghe An?",How come you're not letting me marry a girl from Hà Tĩnh but advising me to marry a girl from Nghệ instead?,C
304,train,Câu chuyện này kể đến già nhỉ?,"This story is something you can tell even when you're old, isn't it?","This story will be told until old age, won't it?",Does this story go until they're old?,A
1730,train,Thử xem xe với đá xem cái nào cứng hơn đấy mà.,Let's compare the car with a rock to see which is harder.,Try seeing whether the car or the rock is harder.,"Let's see which is harder, a car or a rock.",C
839,train,Và bạn giờ có chiếc này mà đi thì tuyệt nhỉ.,"And now you have this to ride, that's great, isn't it?",And it would be wonderful if you had this one to ride now.,"And if you have this one to go out in now, that would be amazing.",A
6131,train,Dầm đường thêm đá là tuyệt vời,Adding stones to the road surface is great.,Adding more stones to the roadbed is wonderful.,Adding ice is amazing,C
8022,train,"Càng ngày tao càng thấy cái suy nghĩ đi kiếm tiền về làm nhà, nó sao sao ấy nhỉ?","The more I think about it, the more I realize how strange the idea of ​​earning money to build a house seems.","The more and more I think about the idea of earning money to build a house, the more it feels kind of off, doesn't it?","Lately, the more I think about it, the more I feel like there's something off about the idea of going out to earn money to build a house.",C
9740,train,"Hồi xưa trên tôi bán 3 nghìn/cốc, đội bạn tôi thách tôi ăn được hẳn 3 cốc no căng bụng luôn.","Back in the day, they sold them for 3,000 VND per cup where I live. My friends challenged me to eat three cups and be completely full.","Back then, I sold them for 3 thousand per cup, and my friends challenged me to eat a whole 3 cups until I was completely full.","Back in the day, I sold them for 3,000 dong per cup, and my friends dared me to eat a full 3 cups until I was completely stuffed.",C
2216,train,Nhìn thấy bão là thấy mệt.,Seeing a storm makes me feel exhausted.,Seeing the storm makes me feel tired.,Seeing Bão makes me feel exhausted.,A
510,train,"Ơ kìa, lên đồ sẵn rồi mãi chẳng thấy sang đón nói lèo chưa cơ chứ?","Hey, I'm all dressed up and ready, but you still haven't come to pick me up? You're just making excuses!","Hey, I've already dressed up and I haven't seen you come to pick me up yet; you didn't even say a word?","Oh come on, I've already gotten all dressed up but you still haven't come to pick me up or even said anything, have you?",C
8419,train,chắc ông ấy từ Cần Thơ chạy về Tiền Giang chứ không phải hướng từ Sài Gòn.,"He was probably traveling from Can Tho to Tien Giang, not from Saigon.","He probably drove from Can Tho back to Tien Giang, not from the direction of Saigon.","He's probably heading from Cần Thơ back to Tiền Giang, not from Saigon direction.",B
8724,train,chừng nào đi bộ về được tới nhà nhắn tin báo cho tôi mừng nhé.,Text me when you manage to walk home so I can be happy to hear from you.,Text me to let me know when you've walked back home so I can be happy.,"Let me know when you've walked back home, okay?",A
9626,train,Có trường hợp nào ma túy bồi thường được án treo chưa anh? Hỏi thiệt đấy nghe.,Have there been any cases where drug-related offenses resulted in suspended sentences? I'm asking seriously.,Are there any cases where drug offenses were compensated for and resulted in a suspended sentence? I'm seriously asking.,"Are there any cases where drug-related offenses got a suspended sentence? I'm seriously asking, just so you know.",B
801,dev,"Ở vầy cũng khỏe, đỡ quét lau mỗi ngày","It's easier living like this, it saves me from sweeping and mopping every day.","Living like this is also quite convenient, as it saves me from sweeping and mopping every day.","It's also good for my health being here, at least I don't have to sweep and mop every day",B
953,dev,bão luôn chứ mưa là gì?,"It's always a storm, not just rain!","It's a full-on storm, not just rain.",That's nothing compared to a real storm!,B
1046,dev,vậy chưa thấy pháo Lao Bảo với Tân Thành rồi?,"So, you haven't seen the artillery at Lao Bao and Tan Thanh yet?",So I haven't seen the fireworks at Lao Bao and Tan Thanh yet?,So you haven't seen the Lao Bao and Tan Thanh fireworks yet?,B
86,dev,Đẹp xịn thế này chị Thu,"This is so beautiful, Thu!","It's so beautiful and fancy, Ms. Thu.","Sister Thu, you're so gorgeous like this!",B
932,dev,tìm em qua quán nhậu tìm nhanh hơn,Finding her through a bar is faster.,Look for me at the drinking restaurant; you'll find me faster.,Looking for me at taverns would be faster,C
479,dev,biết ngày lễ gì đâu mà đi nhỉ?,"I don't even know what holiday it is, so how can I go?","I don't even know what holiday it is, so why go?","I don't even know what holiday it is, so how am I supposed to go?",B
930,dev,Sao mà lắm thành phần ngáo vậy nhỉ?,Why are there so many clueless people?,Why are there so many clueless people?,Why are there so many crazy people around?,A
969,dev,Vậy mai mày xuống chở tao đi nha.,"Okay, will you come pick me up tomorrow?","So come pick me up tomorrow, okay.","So come down tomorrow and take me, okay.",B
493,dev,thật chứ kiểu như vậy chắc không dám lấy chồng luôn đấy.,"Honestly, someone like that probably wouldn't dare get married.","Seriously, if it's like that, I probably wouldn't even dare to get married.","Honestly, if it's like that, I probably wouldn't dare to get married at all.",C
344,dev,"Không được tặng cái gì. Mà già rồi, muốn cũng không được đây.","I didn't receive any gifts. And I'm old now, so even if I wanted to, I couldn't.","I didn't get any gifts. And I'm old now, so even if I wanted to, I couldn't.","I wasn't given anything. But I'm old already, even if I wanted to, I can't anymore.",C
220,dev,Chắc cũng chưa anh ạ. Em chưa thấy đeo túi đó.,"Probably not, sir. I haven't seen him carrying that bag.",Probably not yet. I haven't seen that bag being worn.,Probably not yet. I haven't seen that bag being worn.,B
678,dev,"Chừa lại cho em với, năm ngoái đi muộn nên hết. Uống nước mía xong về.","Leave some for me, please. Last year I came late and it was all gone. I'll drink some sugarcane juice and then go home.",Save some for me; I went late last year so it was all gone. I'll come back after drinking sugarcane juice.,"Save some for me too, last year I went late so it was sold out. After drinking sugarcane juice, I went home.",A
980,dev,tôi cũng muốn về học lại tiếng mẹ đẻ cho nó khỏe,I also want to go back and relearn my mother tongue to feel better.,I also want to go back and study my mother tongue again for peace of mind.,I also want to go back and relearn my mother tongue to keep it strong,C
991,dev,Có mẹ nữa hay sao mà thấy 7 nhỉ?,Is there a mother too? I only see 7.,"Is the mother included as well, or why do I see 7?","Is there another mom or something, why is it 7?",B
243,dev,Đâu dám có người yêu chứ.,I wouldn't dare have a boyfriend.,I wouldn't dare have a lover.,I wouldn't dare have a girlfriend/boyfriend.,C
170,dev,"Trong lành phải biết luôn, bữa nào ta dạo một bữa nhé?","The air is so fresh, let's go for a walk sometime, shall we?","It's so fresh, I have to say; let's go for a stroll sometime, okay?","You should know this right away—let's go out together sometime, okay?",A
274,dev,"Thật không trời, để học kẻo anh ấy kiểm tra bài.","Oh no, I need to study before he gives me a test.",Are you serious? I have to study in case he checks the lesson.,"Seriously, I need to study or else he'll check the lesson.",B
411,dev,Hẹn ngày tôi thết đãi ăn mừng điện thoại mới nhé.,Let's set a date for me to treat you to a celebration for your new phone.,Let's set a date for me to treat you to a celebration for my new phone.,"Let's set a date for me to treat you to a celebratory meal for my new phone, okay?",C
855,dev,Ông ở nhà làm nồi lẩu. Thích hơn nhỉ?,He'd rather stay home and make hot pot. Isn't that better?,"I'll stay home and make a hot pot. That's better, right?","He made a pot of hot pot at home. It's better, right?",B
838,dev,Đồ chua ăn với trứng vịt lộn cực ngon.,Pickled vegetables taste incredibly good when eaten with fertilized duck eggs.,Pickled vegetables are delicious when eaten with fetal duck eggs.,Pickled vegetables eaten with balut are extremely delicious.,C
528,test,Đi đâu thì cút gấp đi chúng mày ơi.,"Get out of here, you guys!","Wherever you're going, get the hell out of here quickly, you guys.","Get out of here quickly, all of you.",B
1145,test,đợt hôm trước lỡ kế hoạch đi suối đó chị.,"We missed our trip to the stream the other day, sis.","The other day, the plan to go to the stream accidentally fell through, sister.","The other day I missed the plan to go to that stream, chị.",A
168,test,Ngày nào đó đi chữa lành nhỉ?,Maybe we should go for healing sometime?,Shall we go heal ourselves some day?,"Maybe one day we could go somewhere for healing, hmm?",A
135,test,"Ngứa người, thèm đi rồi mà giờ đang bận chưa đi được.","I'm itching to go out, but I'm too busy right now.","I'm itching to go, but I'm busy right now and can't leave yet.","Feeling antsy and really want to go already, but I'm currently busy and can't go yet.",B
1330,test,Ông ấy chụp mà nhìn mặt ông ấy nản chưa!,Look how disappointed he looks in that photo!,"He took the photo, and look at how discouraged his face looks!","He takes photos but looking at his face, aren't you fed up yet!",A
940,test,"giờ rủ nó không đi đâu, phải rủ đi uống nước ngọt mới chịu đi","Now, if you invite her anywhere, she won't go; you have to invite her for a soft drink for her to agree to go.","Now if I invite them to go anywhere, they won't go; I have to invite them to go drink soft drinks for them to agree to go.","These days they won't go anywhere, you have to invite them to go drink soda for them to agree to go",B
1132,test,"chưa luôn , bận lướt facebook xem đồ ăn này.","Not yet, I'm busy browsing Facebook looking at food.","Not yet, I'm busy scrolling through Facebook looking at food.","Not yet, I'm busy scrolling Facebook looking at this food.",B
237,test,Không cho đá sân chợ Trụ đâu nhỉ?,"They won't let us play football at Tru Market, will they?","They won't let us play football at the Tru market pitch, will they?","Why won't they let us play at Chợ Trụ field, I wonder?",B
481,test,"Đi nữa không, chứ mới 2 lần chứ mấy",Are you going again? You've only been twice already.,"Want to go again? It's only been twice, after all.",Are we going again? But we've only gone twice!,C
1034,test,Kì dáng mi nhon mất từ khi nào không biết. Bây giờ đoạn thiếu đoạn thừa nhìn khiếp đảm,"I don't know when she lost her slender figure. Now, she looks horrifying with her missing and excess parts.","I don't know when I lost my slim figure. Now, with some parts lacking and others excessive, it looks terrible.","My slender eyebrows disappeared at some point I can't remember. Now with missing patches and overgrown strands, they look absolutely horrifying.",C
561,test,Chỗ nào Yên Thành thế này nhỉ?,Where in Yen Thanh is this place?,Where in Yen Thanh is this?,Where's this Yên Thành anyway?,A
543,test,"Ngồi đấy mà bình yên, ngồi tụm lại là nhao nhác như cái chợ.","Sitting there is peaceful, but gathering in groups makes it as chaotic as a marketplace.","Sit there and act peaceful, but as soon as you gather together, it's as chaotic as a market.","Sitting there peacefully, but when we gather it's chaotic like a market.",C
374,test,"đoạn này ngã tư giao nhau rộng lắm, mà chưa có đèn xanh đỏ cô à","This intersection is very wide, and there are no traffic lights yet, ma'am.","This intersection is very wide, but it doesn't have traffic lights yet, ma'am.","This intersection here is really wide, but there aren't any traffic lights yet, Auntie.",B
1572,test,tự nhiên lại bị thèm nhỉ.,I suddenly have this craving.,I suddenly have a craving.,"Suddenly, I have a craving for it again.",C
1325,test,"Tui khoái nhất vụ này này, nhớ lại vẫn thấy vui",This is my favorite part; I still feel happy remembering it.,I love this part the most; remembering it still makes me happy.,"This is what I enjoyed the most, even thinking back on it still makes me happy",
65,test,"Xã nào mà có sáu chị em gái, mấy cô chỉ được cái nói bậy, không ai nghe ai đâu","In a village with six sisters, all they do is talk nonsense; nobody listens to anyone else.","Which commune has six sisters, where the girls only know how to talk nonsense and no one listens to anyone else?","Which village has six sisters—these girls only know how to talk nonsense, nobody listens to anyone",B
30,test,Vậy lỡ có bầu làm sao?,So what if she gets pregnant?,So what if I happen to get pregnant?,So what if she gets pregnant?,B
