standard,A,B,C,winner
"Về thằng này là không được rồi. Để anh em bàn lại cách sống cái, chứ nghe không ổn.","This guy is no good. Let's discuss how we should live our lives, because this doesn't sound right.","Regarding this guy, it's not going to work. Let us discuss how to handle this again, because this doesn't sound right.","This one's definitely not working out. Let's discuss that living arrangement again, because it doesn't sound right.",
"Phải chi gặp được người để mình nhớ đến thế, bạn mình nhỉ.","I wish I could meet someone who would leave such a lasting impression, my friend.","If only I could meet someone to miss that much, wouldn't it be great, my friend?","I wish I could meet that person I miss so much, my friend.",
Thủy Tề của bạn đâu rồi.,Where is your Sea God?,Where is your Neptune?,Where's your Thủy Tề?,
Đen thật sự. Mới đầu năm mới mang xe ra nhà một cái bị mấy anh hỏi thăm luôn.,"What bad luck. Right at the beginning of the new year, I took my car out of the garage and the police started questioning me.",Really unlucky. Just brought my bike out of the house at the start of the new year and immediately got stopped by the police.,Really unlucky. I just brought my car out at the start of the new year and immediately got questioned by some guys.,
Tỉnh là phải chối chứ sao.,The province has no choice but to deny it.,"If you're awake, you have to deny it, right?","Being cool means you have to deny it, right? What else?",
Có không để biết tìm người yêu bên Đắk Lắk này.,Is it possible to find a lover in Dak Lak?,Is there any way to know how to find a lover here in Đắk Lắk?,Is there a way to find a girlfriend/boyfriend here in Đắk Lắk?,
hôm nào tới chỗ của chúng mày đấy.,I'll come to your place sometime.,"One of these days, I'll come to your place.",Some day I'll come over to your guys' place.,
"Công ty này làm gì, đăng lên cho có ạ?",What does this company actually do? Is it just for show?,"What does this company actually do, or are they just posting for the sake of it?","What does this company even do, just posting for the sake of having something there?",
đầu đường vào nhà chị đấy. Bà con gần với mình đấy nhóc.,"That's at the beginning of the street leading to her house. She's a close relative of ours, kid.","It's at the beginning of the road to my house. They are relatives of ours, kid.","It's at the beginning of the road leading to chị's house. They're relatives close to me, kid.",
Trên cả tuyệt vời. Khi nào đến giờ mới thấy một bác sĩ.,Absolutely amazing. When will I ever see a doctor like this?,Beyond wonderful. It took so long before I finally saw a doctor.,Absolutely wonderful. When do I get to see a doctor?,
"Chỉ mang tính chất minh họa thôi, chứ mùa này sen đào đâu ra.",This is just for illustrative purposes; there are no lotus flowers or peach blossoms available this season.,"This is just for illustration purposes, because there are no lotuses available this season.","Just for illustration purposes only, because this isn't the season for lotus and peach blossoms.",
Mình nhớ bà nội lắm rồi !,I miss my grandmother so much!,I miss my paternal grandmother so much already!,I miss my grandmother so much already!,
Lo việc dân đảm việc nhà thế này mà vợ bảo không được tích sự gì cả,"I'm juggling public affairs and household chores like this, and my wife says I'm not doing anything useful.","I take care of public affairs and handle the housework like this, yet my wife says I'm useless.","I'm taking care of both civic duties and household responsibilities like this, yet my wife says I haven't accomplished anything useful at all.",
